Question	Answer	Source
bonjour	Salut	Editorial
Quels sont vos heures d'ouverture ?	Nous sommes ouverts de lundi à vendredi, de 9h à 21h.	Editorial
Peut-on apporter son vin ?	Oui, vous pouvez venir avec votre vin.	Editorial
Avez-vous un service de livraison ?	Oui, nous pouvons livrer votre commande. Toutefois, des frais de 2$ additionnels seront facturés.	Editorial
Ou êtes-vous situé ?	{"Title": "PoutineShop","Description": "Notre restaurant ce trouve au 802 Rue Saint-Joseph Est.","Image": "http://rdonfack.developpez.com/images/image00.jpg",\n\n  "Url": "https://www.google.ca/maps/place/802+Rue+Saint-Joseph+Est,+Ville+de+Qu%C3%A9bec,+QC+G1K+3C9/@46.816086,-71.2211746,17z/data=!3m1!4b1!4m5!3m4!1s0x4cb896748e4b85b7:0x6a69da6cac080265!8m2!3d46.816086!4d-71.218986", "BoutonText": "Direction..."}	Editorial
Qu'est-ce que de la poutine ?	{"Title": "Poutine","Description": "La poutine est un mets de cuisine québécoise composé, dans sa forme classique, de trois éléments : des frites, du fromage et de la sauce brune.", "Image":"http://rdonfack.developpez.com/images/poutine.jpg","Url": "https://en.wikipedia.org/wiki/Poutine","BoutonText": "En savoir plus..."}	Editorial
Quelle est la composition de base d'une poutine ?	Dans sa forme classique, la poutine est composé des frites, du formage et de la sauce brune.	Editorial
Peut-on ajouter des extras à sa poutine ?	Nous vous offrons un large choix d'extras que vous pouvez ajouter à votre poutine, selon vos envies.	Editorial
